#Name,Accession,Start,Stop,Strand,GeneID,Locus,Locus tag,Protein product,Length,Protein Name
"chromosome","NZ_CP012938.1",6471972,781,"+",29455477,,"Bovatus_RS00005","WP_059365531.1",432,"MULTISPECIES: alginate lyase family protein"
"chromosome","NZ_CP012938.1",796,2202,"+",29455471,,"Bovatus_RS00010","WP_004296896.1",468,"glycosyl hydrolase family 28 protein"
"chromosome","NZ_CP012938.1",2534,2914,"+",29455468,,"Bovatus_RS00015","WP_004322509.1",126,"MULTISPECIES: transposase"
"chromosome","NZ_CP012938.1",2950,3870,"+",29455467,,"Bovatus_RS00020","WP_105096225.1",306,"IS3 family transposase"
"chromosome","NZ_CP012938.1",3852,4859,"-",29455466,,"Bovatus_RS00025","WP_004307071.1",335,"MULTISPECIES: IS110 family transposase"
"chromosome","NZ_CP012938.1",5488,6675,"-",29455457,"uxuA","Bovatus_RS00030","WP_004297007.1",395,"MULTISPECIES: mannonate dehydratase"
"chromosome","NZ_CP012938.1",6711,7526,"-",29455456,,"Bovatus_RS00035","WP_004297005.1",271,"MULTISPECIES: SDR family oxidoreductase"
"chromosome","NZ_CP012938.1",7645,8526,"+",29455453,,"Bovatus_RS00040","WP_004319633.1",293,"MULTISPECIES: AraC family transcriptional regulator"
"chromosome","NZ_CP012938.1",8597,10549,"+",29455452,,"Bovatus_RS00045","WP_004297004.1",650,"MULTISPECIES: glycoside hydrolase family 97 protein"
"chromosome","NZ_CP012938.1",10758,11600,"-",29455446,,"Bovatus_RS00050","WP_004297003.1",280,"MULTISPECIES: aldo/keto reductase"
"chromosome","NZ_CP012938.1",11837,13453,"+",29455445,,"Bovatus_RS00055","WP_004297002.1",538,"MULTISPECIES: hypothetical protein"
"chromosome","NZ_CP012938.1",13479,13862,"-",29455443,,"Bovatus_RS00060","WP_004297000.1",127,"MULTISPECIES: DUF3037 domain-containing protein"
"chromosome","NZ_CP012938.1",13840,14622,"-",29455432,,"Bovatus_RS00065","WP_004296999.1",260,"MULTISPECIES: hypothetical protein"
"chromosome","NZ_CP012938.1",14804,17548,"+",29455418,,"Bovatus_RS00070","WP_004296998.1",914,"MULTISPECIES: helix-turn-helix domain-containing protein"
"chromosome","NZ_CP012938.1",17777,18187,"+",29455391,,"Bovatus_RS00075","WP_004296997.1",136,"MULTISPECIES: hypothetical protein"
"chromosome","NZ_CP012938.1",18189,18719,"+",29455360,,"Bovatus_RS00080","WP_004296996.1",176,"MULTISPECIES: sigma-70 family RNA polymerase sigma factor"
"chromosome","NZ_CP012938.1",18817,21975,"+",29455350,,"Bovatus_RS00085","WP_004296995.1",1052,"MULTISPECIES: TonB-dependent receptor"
"chromosome","NZ_CP012938.1",21989,23743,"+",29455348,,"Bovatus_RS00090","WP_052587867.1",584,"MULTISPECIES: RagB/SusD family nutrient uptake outer membrane protein"
"chromosome","NZ_CP012938.1",23762,25285,"+",29455338,,"Bovatus_RS00095","WP_052587861.1",507,"MULTISPECIES: Ig-like domain-containing protein"
"chromosome","NZ_CP012938.1",25306,26664,"+",29455336,,"Bovatus_RS00100","WP_004296992.1",452,"MULTISPECIES: alginate lyase family protein"
"chromosome","NZ_CP012938.1",26746,28176,"+",29455330,,"Bovatus_RS00105","WP_004296991.1",476,"glycosyl hydrolase family 30"
"chromosome","NZ_CP012938.1",28350,29738,"+",29455328,,"Bovatus_RS00110","WP_004296989.1",462,"MULTISPECIES: glycosyl hydrolase family 28 protein"
"chromosome","NZ_CP012938.1",29789,31714,"+",29455323,,"Bovatus_RS00115","WP_052587865.1",641,"MULTISPECIES: glycoside hydrolase family 127 protein"
"chromosome","NZ_CP012938.1",31730,33655,"+",29455322,,"Bovatus_RS00120","WP_004296987.1",641,"MULTISPECIES: alpha/beta fold hydrolase"
"chromosome","NZ_CP012938.1",33677,35944,"+",29455321,,"Bovatus_RS00125","WP_004296986.1",755,"MULTISPECIES: heparinase II/III family protein"
"chromosome","NZ_CP012938.1",36072,38849,"+",29455319,,"Bovatus_RS00130","WP_004325499.1",925,"MULTISPECIES: helix-turn-helix domain-containing protein"
"chromosome","NZ_CP012938.1",39081,39596,"+",29455317,,"Bovatus_RS00135","WP_004296983.1",171,"MULTISPECIES: sigma-70 family RNA polymerase sigma factor"
"chromosome","NZ_CP012938.1",39641,42850,"+",29455315,,"Bovatus_RS00140","WP_200926977.1",1069,"TonB-dependent receptor"
"chromosome","NZ_CP012938.1",42878,44599,"+",29455311,,"Bovatus_RS00145","WP_004296981.1",573,"MULTISPECIES: RagB/SusD family nutrient uptake outer membrane protein"
"chromosome","NZ_CP012938.1",44634,46097,"+",29455308,,"Bovatus_RS00150","WP_004296980.1",487,"MULTISPECIES: Ig-like domain-containing protein"
"chromosome","NZ_CP012938.1",46150,47415,"+",29455303,,"Bovatus_RS00155","WP_224440800.1",421,"MULTISPECIES: alginate lyase family protein"
"chromosome","NZ_CP012938.1",47509,50649,"+",29455299,,"Bovatus_RS00160","WP_004296978.1",1046,"MULTISPECIES: DUF4981 domain-containing protein"
"chromosome","NZ_CP012938.1",50957,51259,"+",29455298,,"Bovatus_RS00165","WP_004296976.1",100,"MULTISPECIES: helix-turn-helix domain-containing protein"
"chromosome","NZ_CP012938.1",51481,54312,"+",29455297,,"Bovatus_RS00170","WP_004296975.1",943,"MULTISPECIES: helix-turn-helix domain-containing protein"
"chromosome","NZ_CP012938.1",55016,55531,"+",29455294,,"Bovatus_RS00175","WP_008021654.1",171,"MULTISPECIES: RNA polymerase sigma-70 factor"
"chromosome","NZ_CP012938.1",55601,58900,"+",29455293,,"Bovatus_RS00180","WP_004296971.1",1099,"MULTISPECIES: TonB-dependent receptor"
"chromosome","NZ_CP012938.1",58913,60637,"+",29455288,,"Bovatus_RS00185","WP_052587860.1",574,"MULTISPECIES: RagB/SusD family nutrient uptake outer membrane protein"
"chromosome","NZ_CP012938.1",60669,62195,"+",29455284,,"Bovatus_RS00190","WP_004296969.1",508,"MULTISPECIES: Ig-like domain-containing protein"
"chromosome","NZ_CP012938.1",62201,63604,"+",29455282,,"Bovatus_RS00195","WP_004296968.1",467,"MULTISPECIES: alginate lyase family protein"
"chromosome","NZ_CP012938.1",63857,65506,"+",29455278,,"Bovatus_RS00200","WP_004296967.1",549,"MULTISPECIES: glycoside hydrolase 43 family protein"
"chromosome","NZ_CP012938.1",65595,66815,"+",29455276,,"Bovatus_RS00205","WP_004296966.1",406,"MULTISPECIES: glycoside hydrolase family 88 protein"
"chromosome","NZ_CP012938.1",66880,67437,"+",29455275,,"Bovatus_RS00210","WP_004296965.1",185,"MULTISPECIES: redoxin domain-containing protein"
"chromosome","NZ_CP012938.1",67526,68002,"-",29455273,,"Bovatus_RS00215","WP_004296964.1",158,"MULTISPECIES: copper resistance protein NlpE"
"chromosome","NZ_CP012938.1",68060,69352,"-",29455272,,"Bovatus_RS00220","WP_004296963.1",430,"MULTISPECIES: hemolysin family protein"
"chromosome","NZ_CP012938.1",69604,70389,"-",29455268,,"Bovatus_RS00225","WP_004296962.1",261,"MULTISPECIES: M48 family metallopeptidase"
"chromosome","NZ_CP012938.1",70423,72801,"-",29455267,,"Bovatus_RS00230","WP_004296961.1",792,"MULTISPECIES: TonB-dependent receptor"
"chromosome","NZ_CP012938.1",72983,73417,"+",29455263,,"Bovatus_RS00235","WP_004296960.1",144,"MULTISPECIES: DUF2007 domain-containing protein"
"chromosome","NZ_CP012938.1",73443,74261,"+",29455260,,"Bovatus_RS00240","WP_004296959.1",272,"MULTISPECIES: esterase family protein"
"chromosome","NZ_CP012938.1",74670,75464,"-",29455259,,"Bovatus_RS00245","WP_004296958.1",264,"MULTISPECIES: DUF4595 domain-containing protein"
"chromosome","NZ_CP012938.1",75471,76907,"-",29455258,,"Bovatus_RS00250","WP_004296957.1",478,"MULTISPECIES: S41 family peptidase"
"chromosome","NZ_CP012938.1",77088,78155,"+",29455255,"mnmA","Bovatus_RS00255","WP_004296956.1",355,"MULTISPECIES: tRNA 2-thiouridine(34) synthase MnmA"
"chromosome","NZ_CP012938.1",78198,78857,"-",29455252,,"Bovatus_RS00260","WP_052587863.1",219,"MULTISPECIES: response regulator transcription factor"
"chromosome","NZ_CP012938.1",78946,79536,"-",29455251,,"Bovatus_RS00265","WP_004305931.1",196,"MULTISPECIES: DUF4251 domain-containing protein"
"chromosome","NZ_CP012938.1",79604,81031,"-",29455250,"nhaC","Bovatus_RS00270","WP_004296953.1",475,"MULTISPECIES: Na+/H+ antiporter NhaC"
"chromosome","NZ_CP012938.1",81188,81622,"-",29455248,,"Bovatus_RS00275","WP_004296952.1",144,"MULTISPECIES: hypothetical protein"
"chromosome","NZ_CP012938.1",81669,82844,"-",29455246,,"Bovatus_RS00280","WP_004296951.1",391,"MULTISPECIES: MFS transporter"
"chromosome","NZ_CP012938.1",82871,85294,"-",29455243,"pbpC","Bovatus_RS00285","WP_004296950.1",807,"MULTISPECIES: penicillin-binding protein 1C"
"chromosome","NZ_CP012938.1",85309,90939,"-",29455241,,"Bovatus_RS00290","WP_004296949.1",1876,"MULTISPECIES: MG2 domain-containing protein"
"chromosome","NZ_CP012938.1",91039,91440,"+",29455240,,"Bovatus_RS00295","WP_004296948.1",133,"MULTISPECIES: FKBP-type peptidyl-prolyl cis-trans isomerase"
"chromosome","NZ_CP012938.1",91465,91851,"-",29455239,,"Bovatus_RS00300","WP_004296947.1",128,"MULTISPECIES: LytTR family transcriptional regulator"
"chromosome","NZ_CP012938.1",92017,93129,"-",29455238,,"Bovatus_RS00305","WP_004296945.1",370,"MULTISPECIES: AraC family transcriptional regulator"
"chromosome","NZ_CP012938.1",93258,93611,"-",29455231,,"Bovatus_RS00310","WP_004296944.1",117,"MULTISPECIES: DUF1622 domain-containing protein"
"chromosome","NZ_CP012938.1",93953,94963,"-",29455224,,"Bovatus_RS00315","WP_004296943.1",336,"MULTISPECIES: GGGtGRT protein"
"chromosome","NZ_CP012938.1",94984,95685,"-",29455218,,"Bovatus_RS00320","WP_004296942.1",233,"MULTISPECIES: nitrogen-fixing protein NifU"
"chromosome","NZ_CP012938.1",95924,96328,"+",29455217,,"Bovatus_RS00325","WP_004296941.1",134,"MULTISPECIES: TIGR03987 family protein"
"chromosome","NZ_CP012938.1",96930,97430,"+",29455215,,"Bovatus_RS00330","WP_004296938.1",166,"MULTISPECIES: DMP19 family protein"
"chromosome","NZ_CP012938.1",97513,98268,"+",29455207,,"Bovatus_RS00335","WP_004319551.1",251,"MULTISPECIES: hypothetical protein"
"chromosome","NZ_CP012938.1",98301,98846,"+",29455202,,"Bovatus_RS00340","WP_004296936.1",181,"MULTISPECIES: YIP1 family protein"
"chromosome","NZ_CP012938.1",98856,99308,"+",29455199,"smpB","Bovatus_RS00345","WP_004296935.1",150,"MULTISPECIES: SsrA-binding protein"
"chromosome","NZ_CP012938.1",99398,102145,"+",29455198,"metH","Bovatus_RS00350","WP_004296934.1",915,"MULTISPECIES: methionine synthase"
"chromosome","NZ_CP012938.1",102157,102756,"+",29455196,,"Bovatus_RS00355","WP_004296933.1",199,"MULTISPECIES: nitroreductase family protein"
"chromosome","NZ_CP012938.1",102828,102953,"+",70048021,,"Bovatus_RS25590","WP_004296931.1",41,"MULTISPECIES: hypothetical protein"
"chromosome","NZ_CP012938.1",102950,104497,"+",29455194,,"Bovatus_RS00360","WP_004296930.1",515,"MULTISPECIES: sodium:solute symporter family protein"
"chromosome","NZ_CP012938.1",104534,105925,"-",29455189,,"Bovatus_RS00365","WP_004305959.1",463,"MULTISPECIES: transporter substrate-binding domain-containing protein"
"chromosome","NZ_CP012938.1",105950,106561,"-",29455185,"udk","Bovatus_RS00370","WP_008648370.1",203,"MULTISPECIES: uridine kinase"
"chromosome","NZ_CP012938.1",106670,106969,"+",29455183,,"Bovatus_RS00375","WP_004296927.1",99,"MULTISPECIES: Dabb family protein"
"chromosome","NZ_CP012938.1",106985,109042,"+",29455182,,"Bovatus_RS00380","WP_004296926.1",685,"MULTISPECIES: thioredoxin family protein"
"chromosome","NZ_CP012938.1",109148,109852,"-",29455181,,"Bovatus_RS00385","WP_004296925.1",234,"MULTISPECIES: pirin family protein"
"chromosome","NZ_CP012938.1",110048,110650,"+",29455180,,"Bovatus_RS00390","WP_004319547.1",200,"MULTISPECIES: RNA polymerase sigma-70 factor"
"chromosome","NZ_CP012938.1",110737,111726,"+",29455179,,"Bovatus_RS00395","WP_004296923.1",329,"MULTISPECIES: FecR domain-containing protein"
"chromosome","NZ_CP012938.1",111935,115378,"+",29455178,,"Bovatus_RS00400","WP_004296921.1",1147,"MULTISPECIES: TonB-dependent receptor"
"chromosome","NZ_CP012938.1",115402,116793,"+",29455172,,"Bovatus_RS00405","WP_004296920.1",463,"MULTISPECIES: RagB/SusD family nutrient uptake outer membrane protein"
"chromosome","NZ_CP012938.1",116821,118785,"+",29455171,,"Bovatus_RS00410","WP_004296919.1",654,"MULTISPECIES: PQQ-binding-like beta-propeller repeat protein"
"chromosome","NZ_CP012938.1",118792,119673,"+",29455170,,"Bovatus_RS00415","WP_004296918.1",293,"MULTISPECIES: sugar phosphate isomerase/epimerase"
"chromosome","NZ_CP012938.1",119675,120733,"+",29455166,,"Bovatus_RS00420","WP_004319543.1",352,"MULTISPECIES: MBL fold metallo-hydrolase"
"chromosome","NZ_CP012938.1",120754,121653,"+",29455162,,"Bovatus_RS00425","WP_004319541.1",299,"MULTISPECIES: glycerophosphodiester phosphodiesterase family protein"
"chromosome","NZ_CP012938.1",121666,123042,"+",29455161,,"Bovatus_RS00430","WP_004319539.1",458,"MULTISPECIES: MFS transporter"
"chromosome","NZ_CP012938.1",123175,124740,"-",29455159,,"Bovatus_RS00435","WP_004296913.1",521,"MULTISPECIES: ATP-binding protein"
"chromosome","NZ_CP012938.1",124895,125551,"+",29455158,,"Bovatus_RS00440","WP_004296912.1",218,"MULTISPECIES: DUF2490 domain-containing protein"
"chromosome","NZ_CP012938.1",125858,127762,"+",29455157,,"Bovatus_RS00445","WP_032843764.1",634,"MULTISPECIES: fimbrillin family protein"
"chromosome","NZ_CP012938.1",127836,128327,"+",29455156,,"Bovatus_RS00450","WP_004296910.1",163,"MULTISPECIES: PaaI family thioesterase"
"chromosome","NZ_CP012938.1",128586,129437,"+",29455155,"hisG","Bovatus_RS00455","WP_004296908.1",283,"MULTISPECIES: ATP phosphoribosyltransferase"
"chromosome","NZ_CP012938.1",129479,130768,"+",29455149,"hisD","Bovatus_RS00460","WP_004296907.1",429,"MULTISPECIES: histidinol dehydrogenase"
"chromosome","NZ_CP012938.1",130728,131825,"+",29455134,"hisC","Bovatus_RS00465","WP_004296906.1",365,"MULTISPECIES: histidinol-phosphate transaminase"
"chromosome","NZ_CP012938.1",131829,132953,"+",29455131,"hisB","Bovatus_RS00470","WP_004296905.1",374,"MULTISPECIES: bifunctional histidinol-phosphatase/imidazoleglycerol-phosphate dehydratase HisB"
"chromosome","NZ_CP012938.1",132983,133543,"+",29455130,,"Bovatus_RS00475","WP_032852123.1",186,"MULTISPECIES: dual specificity protein phosphatase family protein"
"chromosome","NZ_CP012938.1",133661,135586,"-",29455128,,"Bovatus_RS00480","WP_004296903.1",641,"MULTISPECIES: NAD(+) synthase"
"chromosome","NZ_CP012938.1",136233,139166,"+",29455126,,"Bovatus_RS00485","WP_004296901.1",977,"MULTISPECIES: TonB-dependent receptor"
"chromosome","NZ_CP012938.1",139179,140699,"+",29455124,,"Bovatus_RS00490","WP_004296900.1",506,"MULTISPECIES: RagB/SusD family nutrient uptake outer membrane protein"
"chromosome","NZ_CP012938.1",140725,141615,"+",29455123,,"Bovatus_RS00495","WP_004296899.1",296,"MULTISPECIES: DUF4984 domain-containing protein"
"chromosome","NZ_CP012938.1",141635,143197,"+",29455120,,"Bovatus_RS00500","WP_004296898.1",520,"MULTISPECIES: DUF5003 domain-containing protein"
"chromosome","NZ_CP012938.1",143215,145869,"+",29455119,,"Bovatus_RS00505","WP_004296897.1",884,"MULTISPECIES: DUF4458 domain-containing protein"
"chromosome","NZ_CP012938.1",145900,147609,"+",29455115,,"Bovatus_RS00510","WP_004319524.1",569,"MULTISPECIES: hypothetical protein"
"chromosome","NZ_CP012938.1",147621,149690,"+",29455112,,"Bovatus_RS00515","WP_004297328.1",689,"MULTISPECIES: S8 family serine peptidase"
"chromosome","NZ_CP012938.1",149699,150457,"+",29455108,,"Bovatus_RS00520","WP_004297329.1",252,"MULTISPECIES: DUF1573 domain-containing protein"
"chromosome","NZ_CP012938.1",150479,150973,"+",29455106,,"Bovatus_RS00525","WP_224440799.1",164,"MULTISPECIES: lipocalin family protein"
"chromosome","NZ_CP012938.1",151177,151605,"+",29455097,,"Bovatus_RS00530","WP_004297332.1",142,"MULTISPECIES: transcriptional repressor"
"chromosome","NZ_CP012938.1",151628,152188,"+",29455095,,"Bovatus_RS00535","WP_004297333.1",186,"MULTISPECIES: NADH peroxidase"
"chromosome","NZ_CP012938.1",152283,152918,"+",29455094,,"Bovatus_RS00540","WP_004306006.1",211,"MULTISPECIES: SagB/ThcOx family dehydrogenase"
"chromosome","NZ_CP012938.1",153028,153492,"-",29455093,,"Bovatus_RS00545","WP_004297335.1",154,"MULTISPECIES: thioredoxin domain-containing protein"
"chromosome","NZ_CP012938.1",153510,153809,"-",29455086,"trxA","Bovatus_RS00550","WP_004297336.1",99,"MULTISPECIES: thioredoxin"
"chromosome","NZ_CP012938.1",153978,155105,"+",29455083,,"Bovatus_RS00555","WP_004297338.1",375,"MULTISPECIES: glycosyl transferase"
"chromosome","NZ_CP012938.1",155102,155284,"+",29455082,,"Bovatus_RS00560","WP_004297339.1",60,"MULTISPECIES: hypothetical protein"
"chromosome","NZ_CP012938.1",155371,157527,"-",29455081,,"Bovatus_RS00565","WP_004297340.1",718,"MULTISPECIES: S46 family peptidase"
"chromosome","NZ_CP012938.1",157528,159687,"-",29455078,,"Bovatus_RS00570","WP_004297341.1",719,"MULTISPECIES: S46 family peptidase"
"chromosome","NZ_CP012938.1",159720,160964,"-",29455077,,"Bovatus_RS00575","WP_004297342.1",414,"MULTISPECIES: anaerobic sulfatase-maturation protein"
"chromosome","NZ_CP012938.1",161122,161856,"+",29455073,,"Bovatus_RS00580","WP_004297344.1",244,"MULTISPECIES: DUF4369 domain-containing protein"
"chromosome","NZ_CP012938.1",162016,162330,"+",29455071,,"Bovatus_RS00585","WP_004312028.1",104,"MULTISPECIES: hypothetical protein"
"chromosome","NZ_CP012938.1",162305,163654,"+",29455064,,"Bovatus_RS00590","WP_004297347.1",449,"MULTISPECIES: hypothetical protein"
"chromosome","NZ_CP012938.1",163820,164296,"+",29455063,,"Bovatus_RS00595","WP_004306016.1",158,"MULTISPECIES: hypothetical protein"
"chromosome","NZ_CP012938.1",164395,165153,"-",29455061,,"Bovatus_RS00600","WP_004297350.1",252,"MULTISPECIES: 1-acyl-sn-glycerol-3-phosphate acyltransferase"
"chromosome","NZ_CP012938.1",165274,166527,"+",29455060,,"Bovatus_RS00605","WP_004297351.1",417,"MULTISPECIES: exonuclease SbcCD subunit D C-terminal domain-containing protein"
"chromosome","NZ_CP012938.1",166524,169391,"+",29455055,,"Bovatus_RS00610","WP_004297352.1",955,"MULTISPECIES: AAA family ATPase"
"chromosome","NZ_CP012938.1",169437,170012,"-",70048022,,"Bovatus_RS25595","WP_004297353.1",191,"MULTISPECIES: hypothetical protein"
"chromosome","NZ_CP012938.1",170018,170530,"-",29455052,,"Bovatus_RS00620","WP_004297355.1",170,"MULTISPECIES: sigma-70 family RNA polymerase sigma factor"
"chromosome","NZ_CP012938.1",170599,171507,"-",29455051,,"Bovatus_RS00625","WP_004297356.1",302,"MULTISPECIES: 5-methyltetrahydrofolate--homocysteine methyltransferase"
"chromosome","NZ_CP012938.1",171533,172870,"-",29455050,,"Bovatus_RS00630","WP_004297357.1",445,"MULTISPECIES: dihydroorotase"
"chromosome","NZ_CP012938.1",172867,173610,"-",29455048,,"Bovatus_RS00635","WP_004297358.1",247,"MULTISPECIES: polyprenol monophosphomannose synthase"
"chromosome","NZ_CP012938.1",173797,177159,"+",29455043,"mfd","Bovatus_RS00640","WP_004297360.1",1120,"MULTISPECIES: transcription-repair coupling factor"
"chromosome","NZ_CP012938.1",177270,177482,"+",29455031,,"Bovatus_RS00645","WP_004297361.1",70,"MULTISPECIES: hypothetical protein"
"chromosome","NZ_CP012938.1",177470,177766,"+",29455030,,"Bovatus_RS00650","WP_004297362.1",98,"MULTISPECIES: type II toxin-antitoxin system RelE/ParE family toxin"
"chromosome","NZ_CP012938.1",177771,179630,"-",29455029,,"Bovatus_RS00655","WP_004297363.1",619,"MULTISPECIES: YgiQ family radical SAM protein"
"chromosome","NZ_CP012938.1",179737,179961,"-",29455027,,"Bovatus_RS00660","WP_004297364.1",74,"MULTISPECIES: sulfurtransferase TusA family protein"
"chromosome","NZ_CP012938.1",179961,180278,"-",29455023,,"Bovatus_RS00665","WP_004297365.1",105,"MULTISPECIES: hypothetical protein"
"chromosome","NZ_CP012938.1",180358,183267,"-",29455020,,"Bovatus_RS00670","WP_004297367.1",969,"MULTISPECIES: xanthan lyase"
"chromosome","NZ_CP012938.1",183462,185453,"-",29455018,,"Bovatus_RS00675","WP_004297369.1",663,"MULTISPECIES: glucosamine-6-phosphate deaminase"
"chromosome","NZ_CP012938.1",185602,186378,"-",29455017,,"Bovatus_RS00680","WP_004297370.1",258,"MULTISPECIES: amidohydrolase"
"chromosome","NZ_CP012938.1",186480,187034,"-",29455016,,"Bovatus_RS00685","WP_004297371.1",184,"MULTISPECIES: 1-acyl-sn-glycerol-3-phosphate acyltransferase"
"chromosome","NZ_CP012938.1",187042,187311,"-",29455015,,"Bovatus_RS00690","WP_004306027.1",89,"MULTISPECIES: hypothetical protein"
"chromosome","NZ_CP012938.1",188172,189125,"+",29455014,,"Bovatus_RS00695","WP_004312018.1",317,"MULTISPECIES: tyrosine-type DNA invertase cluster 3b"
"chromosome","NZ_CP012938.1",189540,190289,"+",29455013,,"Bovatus_RS00700","WP_004297375.1",249,"MULTISPECIES: YjbH domain-containing protein"
"chromosome","NZ_CP012938.1",190296,191513,"+",29455005,,"Bovatus_RS00705","WP_004297376.1",405,"MULTISPECIES: hypothetical protein"
"chromosome","NZ_CP012938.1",191560,193023,"+",29454999,,"Bovatus_RS00710","WP_004297377.1",487,"MULTISPECIES: carboxypeptidase regulatory-like domain-containing protein"
"chromosome","NZ_CP012938.1",193378,195594,"-",29454997,,"Bovatus_RS00715","WP_004297378.1",738,"MULTISPECIES: patatin-like phospholipase family protein"
"chromosome","NZ_CP012938.1",195867,197123,"+",29454995,,"Bovatus_RS00720","WP_004297379.1",418,"MULTISPECIES: efflux RND transporter periplasmic adaptor subunit"
"chromosome","NZ_CP012938.1",197127,200231,"+",29454994,,"Bovatus_RS00725","WP_004297380.1",1034,"MULTISPECIES: multidrug efflux RND transporter permease subunit"
"chromosome","NZ_CP012938.1",200231,201610,"+",29454988,,"Bovatus_RS00730","WP_004297381.1",459,"MULTISPECIES: efflux transporter outer membrane subunit"
"chromosome","NZ_CP012938.1",201766,203427,"+",29454987,,"Bovatus_RS00735","WP_004296258.1",553,"MULTISPECIES: IS1182 family transposase"
"chromosome","NZ_CP012938.1",203635,205281,"+",29454985,,"Bovatus_RS00740","WP_004297384.1",548,"MULTISPECIES: diphosphate--fructose-6-phosphate 1-phosphotransferase"
"chromosome","NZ_CP012938.1",205436,206329,"+",29454984,,"Bovatus_RS00745","WP_004297385.1",297,"MULTISPECIES: glycoside hydrolase family 25 protein"
"chromosome","NZ_CP012938.1",206404,207747,"+",29454980,"lpdA","Bovatus_RS00750","WP_004297388.1",447,"MULTISPECIES: dihydrolipoyl dehydrogenase"
"chromosome","NZ_CP012938.1",207767,208489,"+",29454976,,"Bovatus_RS00755","WP_004297389.1",240,"MULTISPECIES: lipoate--protein ligase family protein"
"chromosome","NZ_CP012938.1",208598,209911,"+",29454975,,"Bovatus_RS00760","WP_004297390.1",437,"MULTISPECIES: 2-oxo acid dehydrogenase subunit E2"
"chromosome","NZ_CP012938.1",209949,211985,"+",29454970,,"Bovatus_RS00765","WP_004319330.1",678,"MULTISPECIES: alpha-ketoacid dehydrogenase subunit alpha/beta"
"chromosome","NZ_CP012938.1",211998,212504,"+",29454961,,"Bovatus_RS00770","WP_004297392.1",168,"MULTISPECIES: flavodoxin"
"chromosome","NZ_CP012938.1",212641,213489,"-",29454960,"prmA","Bovatus_RS00775","WP_004297393.1",282,"MULTISPECIES: 50S ribosomal protein L11 methyltransferase"
"chromosome","NZ_CP012938.1",213642,214988,"+",29454959,,"Bovatus_RS00780","WP_004297394.1",448,"MULTISPECIES: hypothetical protein"
"chromosome","NZ_CP012938.1",215014,216609,"+",29454957,,"Bovatus_RS00785","WP_004319328.1",531,"MULTISPECIES: hypothetical protein"
"chromosome","NZ_CP012938.1",216730,217536,"-",29454956,,"Bovatus_RS00790","WP_004297397.1",268,"MULTISPECIES: fimbrillin family protein"
"chromosome","NZ_CP012938.1",217577,218047,"-",29454955,,"Bovatus_RS00795","WP_004297398.1",156,"MULTISPECIES: nucleoside deaminase"
"chromosome","NZ_CP012938.1",218203,219189,"-",29454953,,"Bovatus_RS00800","WP_004297399.1",328,"MULTISPECIES: Gfo/Idh/MocA family oxidoreductase"
"chromosome","NZ_CP012938.1",219647,220870,"-",29454946,,"Bovatus_RS00805","WP_004297401.1",407,"MULTISPECIES: alginate lyase family protein"
"chromosome","NZ_CP012938.1",220912,222336,"-",29454939,,"Bovatus_RS00810","WP_004297402.1",474,"MULTISPECIES: hypothetical protein"
"chromosome","NZ_CP012938.1",222352,223866,"-",29454936,,"Bovatus_RS00815","WP_004297403.1",504,"MULTISPECIES: IPT/TIG domain-containing protein"
"chromosome","NZ_CP012938.1",223886,225367,"-",29454932,,"Bovatus_RS00820","WP_004297404.1",493,"MULTISPECIES: RagB/SusD family nutrient uptake outer membrane protein"
"chromosome","NZ_CP012938.1",225388,228504,"-",29454929,,"Bovatus_RS00825","WP_004319325.1",1038,"MULTISPECIES: TonB-dependent receptor"
"chromosome","NZ_CP012938.1",228528,229730,"-",29454928,,"Bovatus_RS00830","WP_004297406.1",400,"MULTISPECIES: alginate lyase family protein"
"chromosome","NZ_CP012938.1",230954,233443,"-",29454924,,"Bovatus_RS00840","WP_004297410.1",829,"MULTISPECIES: DUF4982 domain-containing protein"
"chromosome","NZ_CP012938.1",233508,234767,"-",29454923,,"Bovatus_RS00845","WP_004297411.1",419,"MULTISPECIES: glycoside hydrolase family 88 protein"
"chromosome","NZ_CP012938.1",234934,239169,"-",29454922,,"Bovatus_RS00850","WP_004297412.1",1411,"MULTISPECIES: response regulator"
"chromosome","NZ_CP012938.1",239156,239995,"-",29454921,,"Bovatus_RS00855","WP_004297413.1",279,"MULTISPECIES: transporter substrate-binding domain-containing protein"
"chromosome","NZ_CP012938.1",240013,242064,"-",29454919,,"Bovatus_RS00860","WP_004297414.1",683,"MULTISPECIES: putative porin"
"chromosome","NZ_CP012938.1",242185,242727,"-",29454916,,"Bovatus_RS00865","WP_004297415.1",180,"MULTISPECIES: 2-oxoacid:acceptor oxidoreductase family protein"
"chromosome","NZ_CP012938.1",242748,243512,"-",29454915,,"Bovatus_RS00870","WP_004297416.1",254,"MULTISPECIES: thiamine pyrophosphate-dependent enzyme"
"chromosome","NZ_CP012938.1",243525,243698,"-",52035251,,"Bovatus_RS25120","WP_004297417.1",57,"MULTISPECIES: hypothetical protein"
"chromosome","NZ_CP012938.1",243706,244788,"-",29454906,,"Bovatus_RS00875","WP_004297418.1",360,"MULTISPECIES: 3-methyl-2-oxobutanoate dehydrogenase subunit VorB"
"chromosome","NZ_CP012938.1",244800,245027,"-",29454905,,"Bovatus_RS00880","WP_004297419.1",75,"MULTISPECIES: ferredoxin family protein"
"chromosome","NZ_CP012938.1",245082,245363,"-",29454903,,"Bovatus_RS00885","WP_004297420.1",93,"MULTISPECIES: tetratricopeptide repeat protein"
"chromosome","NZ_CP012938.1",245620,246168,"+",29454901,,"Bovatus_RS00890","WP_004297421.1",182,"MULTISPECIES: RNA polymerase sigma-70 factor"
"chromosome","NZ_CP012938.1",246296,247273,"+",29454898,,"Bovatus_RS00895","WP_004297423.1",325,"MULTISPECIES: DUF4974 domain-containing protein"
