#Name,Accession,Start,Stop,Strand,GeneID,Locus,Locus tag,Protein product,Length,Protein Name
"chromosome","NZ_CP012938.1",2973316,2976684,"-",29456243,,"Bovatus_RS11860","WP_004298971.1",1122,"MULTISPECIES: SusC/RagA family TonB-linked outer membrane protein"
"chromosome","NZ_CP012938.1",2976952,2977965,"-",29453704,,"Bovatus_RS11865","WP_004298967.1",337,"MULTISPECIES: DUF4974 domain-containing protein"
"chromosome","NZ_CP012938.1",2978037,2978627,"-",29451426,,"Bovatus_RS11870","WP_004298965.1",196,"MULTISPECIES: RNA polymerase sigma-70 factor"
"chromosome","NZ_CP012938.1",2978740,2981271,"-",29454609,,"Bovatus_RS11875","WP_004298963.1",843,"MULTISPECIES: carbohydate-binding domain-containing protein"
"chromosome","NZ_CP012938.1",2981279,2982352,"-",29454768,,"Bovatus_RS11880","WP_004323725.1",357,"MULTISPECIES: cellulase family glycosylhydrolase"
"chromosome","NZ_CP012938.1",2982389,2983867,"-",29452002,,"Bovatus_RS11885","WP_004323724.1",492,"MULTISPECIES: hypothetical protein"
"chromosome","NZ_CP012938.1",2983914,2985329,"-",29451491,,"Bovatus_RS11890","WP_004298958.1",471,"MULTISPECIES: hypothetical protein"
"chromosome","NZ_CP012938.1",2985329,2986972,"-",29455430,,"Bovatus_RS11895","WP_004323723.1",547,"MULTISPECIES: RagB/SusD family nutrient uptake outer membrane protein"
"chromosome","NZ_CP012938.1",2987005,2990421,"-",29456242,,"Bovatus_RS11900","WP_004298953.1",1138,"MULTISPECIES: SusC/RagA family TonB-linked outer membrane protein"
"chromosome","NZ_CP012938.1",2990751,2991338,"+",29455426,,"Bovatus_RS11905","WP_004298951.1",195,"MULTISPECIES: RNA polymerase sigma-70 factor"
"chromosome","NZ_CP012938.1",2991393,2992439,"+",29453834,,"Bovatus_RS11910","WP_004323722.1",348,"MULTISPECIES: FecR domain-containing protein"
"chromosome","NZ_CP012938.1",2992697,2994895,"-",29455329,,"Bovatus_RS11915","WP_004298947.1",732,"GH92 family glycosyl hydrolase"
"chromosome","NZ_CP012938.1",2994928,2996202,"-",29451495,,"Bovatus_RS11920","WP_004298945.1",424,"MULTISPECIES: hypothetical protein"
"chromosome","NZ_CP012938.1",2996433,2998211,"+",29451783,"sppA","Bovatus_RS11925","WP_004298943.1",592,"MULTISPECIES: signal peptide peptidase SppA"
"chromosome","NZ_CP012938.1",2998222,2999352,"+",29451494,"lpxK","Bovatus_RS11930","WP_004298941.1",376,"MULTISPECIES: tetraacyldisaccharide 4\\'-kinase"
"chromosome","NZ_CP012938.1",2999309,3000118,"+",29456240,,"Bovatus_RS11935","WP_004298940.1",269,"MULTISPECIES: purine-nucleoside phosphorylase"
"chromosome","NZ_CP012938.1",3000135,3001172,"+",29456207,"thiL","Bovatus_RS11940","WP_004298938.1",345,"MULTISPECIES: thiamine-phosphate kinase"
"chromosome","NZ_CP012938.1",3001863,3003098,"+",29456188,,"Bovatus_RS11955","WP_004298933.1",411,"MULTISPECIES: site-specific integrase"
"chromosome","NZ_CP012938.1",3003908,3005686,"-",29453920,,"Bovatus_RS11965","WP_004300191.1",592,"MULTISPECIES: IS66 family transposase"
"chromosome","NZ_CP012938.1",3005775,3006119,"-",29452170,"tnpB","Bovatus_RS11970","WP_004297053.1",114,"MULTISPECIES: IS66 family insertion sequence element accessory protein TnpB"
"chromosome","NZ_CP012938.1",3006121,3006489,"-",29454767,,"Bovatus_RS11975","WP_170834904.1",122,"MULTISPECIES: hypothetical protein"
"chromosome","NZ_CP012938.1",3006694,3009117,"-",29455412,,"Bovatus_RS11980","WP_032855575.1",807,"MULTISPECIES: PQQ-binding-like beta-propeller repeat protein"
"chromosome","NZ_CP012938.1",3009122,3011701,"-",29453918,,"Bovatus_RS11985","WP_004297743.1",859,"MULTISPECIES: glycoside hydrolase family 3 C-terminal domain-containing protein"
"chromosome","NZ_CP012938.1",3012411,3013364,"-",29455424,,"Bovatus_RS11995","WP_052587911.1",317,"MULTISPECIES: DUF6528 family protein"
"chromosome","NZ_CP012938.1",3013407,3014354,"-",29455814,,"Bovatus_RS12000","WP_004297747.1",315,"MULTISPECIES: phosphodiester glycosidase family protein"
"chromosome","NZ_CP012938.1",3014439,3016352,"-",29455728,,"Bovatus_RS12005","WP_052587902.1",637,"MULTISPECIES: BACON domain-containing protein"
"chromosome","NZ_CP012938.1",3016366,3017334,"-",29452030,,"Bovatus_RS12010","WP_105096245.1",322,"MULTISPECIES: phosphodiester glycosidase family protein"
"chromosome","NZ_CP012938.1",3017364,3019130,"-",29452937,,"Bovatus_RS12015","WP_052587903.1",588,"MULTISPECIES: RagB/SusD family nutrient uptake outer membrane protein"
"chromosome","NZ_CP012938.1",3019146,3022577,"-",29453159,,"Bovatus_RS12020","WP_224440851.1",1143,"MULTISPECIES: TonB-dependent receptor"
"chromosome","NZ_CP012938.1",3022860,3024059,"-",29454122,,"Bovatus_RS12025","WP_004297752.1",399,"MULTISPECIES: DUF4974 domain-containing protein"
"chromosome","NZ_CP012938.1",3024190,3024777,"-",29451510,,"Bovatus_RS12030","WP_004297753.1",195,"MULTISPECIES: RNA polymerase sigma factor"
"chromosome","NZ_CP012938.1",3026477,3027604,"+",52035301,,"Bovatus_RS25500","WP_167560861.1",375,"MULTISPECIES: hypothetical protein"
"chromosome","NZ_CP012938.1",3027607,3028533,"+",29455786,,"Bovatus_RS12045","WP_052587904.1",308,"MULTISPECIES: hypothetical protein"
"chromosome","NZ_CP012938.1",3028526,3029350,"+",29455403,,"Bovatus_RS12050","WP_004297762.1",274,"MULTISPECIES: hypothetical protein"
"chromosome","NZ_CP012938.1",3029362,3029655,"+",29455890,,"Bovatus_RS12055","WP_004297763.1",97,"MULTISPECIES: DUF4120 domain-containing protein"
"chromosome","NZ_CP012938.1",3029668,3030171,"+",29455375,,"Bovatus_RS12060","WP_004297764.1",167,"MULTISPECIES: hypothetical protein"
"chromosome","NZ_CP012938.1",3030403,3031368,"+",29452601,,"Bovatus_RS12065","WP_004297765.1",321,"MULTISPECIES: hypothetical protein"
"chromosome","NZ_CP012938.1",3031352,3031627,"+",29452739,,"Bovatus_RS12070","WP_004297766.1",91,"MULTISPECIES: hypothetical protein"
"chromosome","NZ_CP012938.1",3031614,3032417,"+",29454676,,"Bovatus_RS12075","WP_004297767.1",267,"MULTISPECIES: DUF4121 family protein"
"chromosome","NZ_CP012938.1",3032420,3033238,"+",29453940,,"Bovatus_RS12080","WP_004297768.1",272,"MULTISPECIES: N-6 DNA methylase"
"chromosome","NZ_CP012938.1",3033311,3034468,"+",29455540,,"Bovatus_RS12085","WP_052587905.1",385,"MULTISPECIES: hypothetical protein"
"chromosome","NZ_CP012938.1",3034835,3035197,"+",29453267,,"Bovatus_RS12090","WP_004297770.1",120,"MULTISPECIES: hypothetical protein"
"chromosome","NZ_CP012938.1",3035392,3035919,"-",52035302,,"Bovatus_RS25505","WP_004297772.1",175,"MULTISPECIES: hypothetical protein"
"chromosome","NZ_CP012938.1",3035975,3036439,"-",29455211,,"Bovatus_RS12100","WP_008026727.1",154,"MULTISPECIES: DUF3872 domain-containing protein"
"chromosome","NZ_CP012938.1",3036460,3037047,"-",29455504,,"Bovatus_RS12105","WP_004297774.1",195,"MULTISPECIES: conjugal transfer protein TraO"
"chromosome","NZ_CP012938.1",3037044,3037961,"-",29456018,"traN","Bovatus_RS12110","WP_004297775.1",305,"MULTISPECIES: conjugative transposon protein TraN"
"chromosome","NZ_CP012938.1",3038021,3039319,"-",29451991,"traM","Bovatus_RS12115","WP_052587906.1",432,"MULTISPECIES: conjugative transposon protein TraM"
"chromosome","NZ_CP012938.1",3039270,3039569,"-",29452318,,"Bovatus_RS12120","WP_004297777.1",99,"MULTISPECIES: TraL conjugative transposon family protein"
"chromosome","NZ_CP012938.1",3039566,3040189,"-",29451994,"traK","Bovatus_RS12125","WP_004297778.1",207,"MULTISPECIES: conjugative transposon protein TraK"
"chromosome","NZ_CP012938.1",3040211,3041224,"-",29454659,"traJ","Bovatus_RS12130","WP_004297779.1",337,"MULTISPECIES: conjugative transposon protein TraJ"
"chromosome","NZ_CP012938.1",3041227,3041871,"-",29452225,,"Bovatus_RS12135","WP_004297780.1",214,"MULTISPECIES: DUF4141 domain-containing protein"
"chromosome","NZ_CP012938.1",3041868,3042227,"-",29455101,,"Bovatus_RS12140","WP_052587913.1",119,"MULTISPECIES: DUF3876 domain-containing protein"
"chromosome","NZ_CP012938.1",3042477,3044300,"-",29453176,,"Bovatus_RS12145","WP_004297783.1",607,"reverse transcriptase/maturase family protein"
"chromosome","NZ_CP012938.1",3044869,3047268,"-",29452460,,"Bovatus_RS12150","WP_052587907.1",799,"TraG family conjugative transposon ATPase"
"chromosome","NZ_CP012938.1",3047265,3047585,"-",29453368,,"Bovatus_RS12155","WP_004297787.1",106,"MULTISPECIES: DUF4133 domain-containing protein"
"chromosome","NZ_CP012938.1",3047591,3047887,"-",29451769,,"Bovatus_RS12160","WP_004297788.1",98,"MULTISPECIES: DUF4134 domain-containing protein"
"chromosome","NZ_CP012938.1",3048304,3049311,"+",29454461,,"Bovatus_RS12165","WP_004297790.1",335,"MULTISPECIES: PDDEXK nuclease domain-containing protein"
"chromosome","NZ_CP012938.1",3049388,3050062,"-",29453686,,"Bovatus_RS12170","WP_004297792.1",224,"MULTISPECIES: DUF4122 family protein"
"chromosome","NZ_CP012938.1",3050050,3050508,"-",29451804,,"Bovatus_RS12175","WP_008026391.1",152,"MULTISPECIES: DUF3408 domain-containing protein"
"chromosome","NZ_CP012938.1",3050521,3051279,"-",29452558,,"Bovatus_RS12180","WP_004297794.1",252,"MULTISPECIES: AAA family ATPase"
"chromosome","NZ_CP012938.1",3051367,3051780,"+",52035260,,"Bovatus_RS25240","WP_085939367.1",137,"MULTISPECIES: hypothetical protein"
"chromosome","NZ_CP012938.1",3052128,3052550,"+",29456153,,"Bovatus_RS12190","WP_004297798.1",140,"MULTISPECIES: hypothetical protein"
"chromosome","NZ_CP012938.1",3052535,3053791,"+",29454806,,"Bovatus_RS12195","WP_004297799.1",418,"relaxase/mobilization nuclease domain-containing protein"
"chromosome","NZ_CP012938.1",3053833,3055878,"+",29455734,,"Bovatus_RS12200","WP_004297800.1",681,"MULTISPECIES: YWFCY domain-containing protein"
"chromosome","NZ_CP012938.1",3055961,3057241,"-",29455807,,"Bovatus_RS12205","WP_004297801.1",426,"MULTISPECIES: sigma-54 dependent transcriptional regulator"
"chromosome","NZ_CP012938.1",3057246,3059618,"-",29456061,,"Bovatus_RS12210","WP_004297802.1",790,"MULTISPECIES: ATP-binding protein"
"chromosome","NZ_CP012938.1",3060033,3061007,"-",29455347,,"Bovatus_RS12215","WP_004297804.1",324,"MULTISPECIES: glycoside hydrolase family 43 protein"
"chromosome","NZ_CP012938.1",3061041,3062159,"-",29456030,,"Bovatus_RS12220","WP_004297805.1",372,"MULTISPECIES: endo-1,4-beta-xylanase"
"chromosome","NZ_CP012938.1",3062179,3063573,"-",29455053,,"Bovatus_RS12225","WP_004297806.1",464,"MULTISPECIES: MFS transporter"
"chromosome","NZ_CP012938.1",3063951,3067490,"-",31619825,,"Bovatus_RS24800","WP_004297807.1",1179,"MULTISPECIES: glycoside hydrolase family 97 catalytic domain-containing protein"
"chromosome","NZ_CP012938.1",3067514,3069130,"-",29451866,,"Bovatus_RS12235","WP_004297808.1",538,"MULTISPECIES: hypothetical protein"
"chromosome","NZ_CP012938.1",3069154,3072201,"-",29454110,,"Bovatus_RS12240","WP_224440850.1",1015,"MULTISPECIES: glycosyl hydrolase 115 family protein"
"chromosome","NZ_CP012938.1",3072419,3076420,"+",29453634,,"Bovatus_RS12245","WP_004297810.1",1333,"MULTISPECIES: response regulator"
"chromosome","NZ_CP012938.1",3076484,3077869,"-",29455835,,"Bovatus_RS12250","WP_004297811.1",461,"MULTISPECIES: glycoside hydrolase family 43 protein"
"chromosome","NZ_CP012938.1",3077909,3080266,"-",29455949,,"Bovatus_RS12255","WP_004297812.1",785,"MULTISPECIES: DUF4982 domain-containing protein"
"chromosome","NZ_CP012938.1",3080280,3083162,"-",29455368,,"Bovatus_RS12260","WP_004297813.1",960,"MULTISPECIES: glycoside hydrolase family 2"
"chromosome","NZ_CP012938.1",3083281,3085284,"-",29456023,,"Bovatus_RS12265","WP_004297814.1",667,"MULTISPECIES: glycoside hydrolase family 97 protein"
"chromosome","NZ_CP012938.1",3085532,3085924,"-",29453513,,"Bovatus_RS12270","WP_052587909.1",130,"MULTISPECIES: helix-turn-helix domain-containing protein"
"chromosome","NZ_CP012938.1",3086231,3088636,"-",29452746,,"Bovatus_RS12275","WP_004297817.1",801,"MULTISPECIES: glycoside hydrolase family 127 protein"
"chromosome","NZ_CP012938.1",3088633,3091218,"-",29455544,,"Bovatus_RS12280","WP_004297818.1",861,"MULTISPECIES: DUF5110 domain-containing protein"
"chromosome","NZ_CP012938.1",3091286,3093850,"-",29455779,,"Bovatus_RS12285","WP_004297819.1",854,"MULTISPECIES: DUF4982 domain-containing protein"
"chromosome","NZ_CP012938.1",3093878,3096295,"-",29454827,,"Bovatus_RS12290","WP_059365514.1",805,"MULTISPECIES: DUF5110 domain-containing protein"
"chromosome","NZ_CP012938.1",3096308,3098422,"-",29455985,,"Bovatus_RS12295","WP_004297616.1",704,"MULTISPECIES: alpha-L-fucosidase"
"chromosome","NZ_CP012938.1",3098444,3100414,"-",29452970,,"Bovatus_RS12300","WP_105096238.1",656,"MULTISPECIES: hypothetical protein"
"chromosome","NZ_CP012938.1",3100499,3102073,"-",29455440,,"Bovatus_RS12305","WP_224440849.1",524,"hypothetical protein"
"chromosome","NZ_CP012938.1",3102028,3102906,"-",70048035,,"Bovatus_RS25670","WP_004297611.1",292,"MG2 domain-containing protein"
"chromosome","NZ_CP012938.1",3103044,3103742,"-",29453922,,"Bovatus_RS12310","WP_004297609.1",232,"MULTISPECIES: glycosyl hydrolase 115 family protein"
"chromosome","NZ_CP012938.1",3103774,3105306,"-",29456236,,"Bovatus_RS12315","WP_070275804.1",510,"MULTISPECIES: family 43 glycosylhydrolase"
"chromosome","NZ_CP012938.1",3105367,3106719,"-",29452976,,"Bovatus_RS12320","WP_004297605.1",450,"MULTISPECIES: glycoside hydrolase family 27 protein"
"chromosome","NZ_CP012938.1",3106857,3108890,"-",29453396,,"Bovatus_RS12325","WP_004297606.1",677,"MULTISPECIES: right-handed parallel beta-helix repeat-containing protein"
"chromosome","NZ_CP012938.1",3108924,3110987,"-",29452943,,"Bovatus_RS12330","WP_105096237.1",687,"MULTISPECIES: endo-1,4-beta-xylanase"
"chromosome","NZ_CP012938.1",3111083,3112099,"-",29454082,,"Bovatus_RS12335","WP_004297739.1",338,"MULTISPECIES: DUF4973 domain-containing protein"
"chromosome","NZ_CP012938.1",3112178,3114247,"-",29453005,,"Bovatus_RS12340","WP_004297738.1",689,"MULTISPECIES: RagB/SusD family nutrient uptake outer membrane protein"
"chromosome","NZ_CP012938.1",3114247,3117342,"-",29455481,,"Bovatus_RS12345","WP_052587898.1",1031,"MULTISPECIES: TonB-dependent receptor"
"chromosome","NZ_CP012938.1",3117370,3118767,"-",29453006,,"Bovatus_RS12350","WP_004297735.1",465,"MULTISPECIES: IPT/TIG domain-containing protein"
"chromosome","NZ_CP012938.1",3119424,3121535,"-",29453008,,"Bovatus_RS12355","WP_004297732.1",703,"MULTISPECIES: alpha-glucuronidase"
"chromosome","NZ_CP012938.1",3121556,3124084,"-",29452027,,"Bovatus_RS12360","WP_004297730.1",842,"MULTISPECIES: glycoside hydrolase family 3 C-terminal domain-containing protein"
"chromosome","NZ_CP012938.1",3124228,3125826,"-",29452028,,"Bovatus_RS12365","WP_004297728.1",532,"MULTISPECIES: glycoside hydrolase 43 family protein"
"chromosome","NZ_CP012938.1",3125847,3129149,"-",29452156,,"Bovatus_RS12370","WP_004297727.1",1100,"MULTISPECIES: glycoside hydrolase N-terminal domain-containing protein"
"chromosome","NZ_CP012938.1",3129198,3130574,"-",29451431,,"Bovatus_RS12375","WP_004297725.1",458,"MULTISPECIES: glycoside hydrolase family 43 protein"
"chromosome","NZ_CP012938.1",3130591,3132576,"-",29452127,,"Bovatus_RS12380","WP_004297724.1",661,"MULTISPECIES: glycoside hydrolase family 97 protein"
"chromosome","NZ_CP012938.1",3134019,3134360,"-",29453622,,"Bovatus_RS12390","WP_004297722.1",113,"MULTISPECIES: hypothetical protein"
"chromosome","NZ_CP012938.1",3134370,3134552,"-",29455105,,"Bovatus_RS12395","WP_138274533.1",60,"MULTISPECIES: hypothetical protein"
"chromosome","NZ_CP012938.1",3134687,3134887,"-",52035261,,"Bovatus_RS25245","WP_004297719.1",66,"MULTISPECIES: hypothetical protein"
"chromosome","NZ_CP012938.1",3135250,3137610,"-",29455708,,"Bovatus_RS12405","WP_004297716.1",786,"MULTISPECIES: DUF4982 domain-containing protein"
"chromosome","NZ_CP012938.1",3137626,3140181,"-",29452806,,"Bovatus_RS12410","WP_004297715.1",851,"MULTISPECIES: glycosyl hydrolase 115 family protein"
"chromosome","NZ_CP012938.1",3140249,3142267,"-",29454310,,"Bovatus_RS12415","WP_004297713.1",672,"MULTISPECIES: hypothetical protein"
"chromosome","NZ_CP012938.1",3142298,3144052,"-",29452714,,"Bovatus_RS12420","WP_004297712.1",584,"MULTISPECIES: endo-1,4-beta-xylanase"
"chromosome","NZ_CP012938.1",3144083,3145120,"-",29452652,,"Bovatus_RS12425","WP_004297711.1",345,"MULTISPECIES: DUF5627 domain-containing protein"
"chromosome","NZ_CP012938.1",3145168,3146922,"-",29455406,,"Bovatus_RS12430","WP_049942685.1",584,"MULTISPECIES: RagB/SusD family nutrient uptake outer membrane protein"
"chromosome","NZ_CP012938.1",3146947,3149766,"-",29452693,,"Bovatus_RS12435","WP_004297709.1",939,"MULTISPECIES: SusC/RagA family TonB-linked outer membrane protein"
"chromosome","NZ_CP012938.1",3149793,3151667,"-",29451591,,"Bovatus_RS12440","WP_004297708.1",624,"MULTISPECIES: RagB/SusD family nutrient uptake outer membrane protein"
"chromosome","NZ_CP012938.1",3151686,3154796,"-",29456101,,"Bovatus_RS12445","WP_052587896.1",1036,"MULTISPECIES: TonB-dependent receptor"
"chromosome","NZ_CP012938.1",3155388,3159512,"-",29453100,,"Bovatus_RS12450","WP_224440848.1",1374,"MULTISPECIES: hybrid sensor histidine kinase/response regulator transcription factor"
"chromosome","NZ_CP012938.1",3159804,3161087,"+",29453306,,"Bovatus_RS12455","WP_004297699.1",427,"MULTISPECIES: Gfo/Idh/MocA family oxidoreductase"
"chromosome","NZ_CP012938.1",3162158,3162985,"+",29454589,,"Bovatus_RS12470","WP_004297696.1",275,"FAD:protein FMN transferase"
"chromosome","NZ_CP012938.1",3163003,3164433,"+",29451744,,"Bovatus_RS12475","WP_004297695.1",476,"Gfo/Idh/MocA family oxidoreductase"
"chromosome","NZ_CP012938.1",3166390,3167229,"-",70048036,,"Bovatus_RS25675","WP_224440858.1",279,"MULTISPECIES: beta-galactosidase small subunit"
"chromosome","NZ_CP012938.1",3169494,3170537,"-",29452851,,"Bovatus_RS12495","WP_224440847.1",347,"MULTISPECIES: glycoside hydrolase family 43 protein"
"chromosome","NZ_CP012938.1",3170595,3173180,"-",29455305,,"Bovatus_RS12500","WP_224440857.1",861,"MULTISPECIES: glycoside hydrolase family 31 protein"
"chromosome","NZ_CP012938.1",3173228,3175654,"-",29451569,,"Bovatus_RS12505","WP_052587827.1",808,"MULTISPECIES: glycoside hydrolase N-terminal domain-containing protein"
"chromosome","NZ_CP012938.1",3175676,3176089,"-",29455129,,"Bovatus_RS12510","WP_004296109.1",137,"MULTISPECIES: PDZ domain-containing protein"
"chromosome","NZ_CP012938.1",3176109,3176813,"-",29455450,,"Bovatus_RS12515","WP_004296110.1",234,"MULTISPECIES: hypothetical protein"
"chromosome","NZ_CP012938.1",3176907,3178880,"-",29456024,,"Bovatus_RS12520","WP_224440846.1",657,"alpha-L-fucosidase"
"chromosome","NZ_CP012938.1",3182116,3183909,"+",29454520,,"Bovatus_RS12530","WP_004296116.1",597,"MULTISPECIES: DUF3945 domain-containing protein"
"chromosome","NZ_CP012938.1",3183957,3184232,"+",29454373,,"Bovatus_RS12535","WP_004296117.1",91,"MULTISPECIES: DUF4099 domain-containing protein"
"chromosome","NZ_CP012938.1",3184329,3186089,"+",29452320,,"Bovatus_RS12540","WP_004296118.1",586,"MULTISPECIES: DNA topoisomerase"
"chromosome","NZ_CP012938.1",3186351,3186572,"-",52035303,,"Bovatus_RS25510","WP_004296122.1",73,"MULTISPECIES: hypothetical protein"
"chromosome","NZ_CP012938.1",3186609,3186818,"+",31619826,,"Bovatus_RS24805","WP_004296124.1",69,"MULTISPECIES: hypothetical protein"
"chromosome","NZ_CP012938.1",3186837,3187910,"+",29456057,,"Bovatus_RS12550","WP_004296125.1",357,"MULTISPECIES: PRTRC system protein E"
"chromosome","NZ_CP012938.1",3187931,3188152,"+",29456165,,"Bovatus_RS12555","WP_004296126.1",73,"MULTISPECIES: PRTRC system protein C"
"chromosome","NZ_CP012938.1",3188156,3188338,"+",70048037,,"Bovatus_RS25680","WP_004296127.1",60,"MULTISPECIES: hypothetical protein"
"chromosome","NZ_CP012938.1",3188338,3189297,"+",29453152,,"Bovatus_RS12560","WP_224440845.1",319,"MULTISPECIES: hypothetical protein"
"chromosome","NZ_CP012938.1",3189470,3190171,"+",29455546,,"Bovatus_RS12565","WP_004296130.1",233,"MULTISPECIES: prokaryotic E2 ligase family D protein"
"chromosome","NZ_CP012938.1",3190168,3190965,"+",29453889,,"Bovatus_RS12570","WP_004296131.1",265,"MULTISPECIES: PRTRC system ThiF family protein"
"chromosome","NZ_CP012938.1",3191052,3191348,"-",29455717,,"Bovatus_RS12575","WP_004296132.1",98,"MULTISPECIES: helix-turn-helix domain-containing protein"
"chromosome","NZ_CP012938.1",3191680,3191976,"+",29455539,,"Bovatus_RS12580","WP_004296134.1",98,"MULTISPECIES: helix-turn-helix domain-containing protein"
"chromosome","NZ_CP012938.1",3191987,3192286,"+",29452700,,"Bovatus_RS12585","WP_004296135.1",99,"MULTISPECIES: helix-turn-helix domain-containing protein"
"chromosome","NZ_CP012938.1",3192626,3192832,"-",29454119,,"Bovatus_RS12590","WP_004307025.1",68,"MULTISPECIES: hypothetical protein"
"chromosome","NZ_CP012938.1",3192885,3193370,"-",29454758,,"Bovatus_RS12595","WP_004307024.1",161,"MULTISPECIES: cold shock domain-containing protein"
"chromosome","NZ_CP012938.1",3193424,3194548,"-",29455188,,"Bovatus_RS12600","WP_004296138.1",374,"MULTISPECIES: DEAD/DEAH box helicase"
"chromosome","NZ_CP012938.1",3194638,3195711,"-",29451475,,"Bovatus_RS12605","WP_004296139.1",357,"MULTISPECIES: nitronate monooxygenase"
"chromosome","NZ_CP012938.1",3196083,3196382,"-",29451798,,"Bovatus_RS12610","WP_004296140.1",99,"MULTISPECIES: RNA-binding protein"
"chromosome","NZ_CP012938.1",3196697,3197359,"+",29453124,"ung","Bovatus_RS12615","WP_004296142.1",220,"uracil-DNA glycosylase"
"chromosome","NZ_CP012938.1",3197407,3198180,"+",29453582,,"Bovatus_RS12620","WP_052587843.1",257,"LuxR C-terminal-related transcriptional regulator"
"chromosome","NZ_CP012938.1",3198218,3198802,"-",29452323,,"Bovatus_RS12625","WP_004296144.1",194,"MULTISPECIES: hypothetical protein"
"chromosome","NZ_CP012938.1",3198941,3201004,"+",29452736,,"Bovatus_RS12630","WP_004296145.1",687,"AAA family ATPase"
"chromosome","NZ_CP012938.1",3201106,3202662,"-",29451825,,"Bovatus_RS12635","WP_052587844.1",518,"ATP-binding protein"
"chromosome","NZ_CP012938.1",3202811,3203731,"-",29455364,,"Bovatus_RS12640","WP_004296147.1",306,"N-acetylmuramoyl-L-alanine amidase"
"chromosome","NZ_CP012938.1",3203762,3204112,"-",29452999,,"Bovatus_RS12645","WP_004296148.1",116,"MULTISPECIES: hypothetical protein"
"chromosome","NZ_CP012938.1",3204198,3204716,"-",29455946,,"Bovatus_RS12650","WP_004296149.1",172,"MULTISPECIES: DNA-binding protein"
"chromosome","NZ_CP012938.1",3205239,3205811,"+",29455310,,"Bovatus_RS12655","WP_004327180.1",190,"MULTISPECIES: hypothetical protein"
"chromosome","NZ_CP012938.1",3205808,3206677,"+",29453480,,"Bovatus_RS12660","WP_004296154.1",289,"nucleotidyl transferase AbiEii/AbiGii toxin family protein"
"chromosome","NZ_CP012938.1",3206980,3207639,"-",29455575,,"Bovatus_RS12665","WP_004296155.1",219,"MIP family channel protein"
"chromosome","NZ_CP012938.1",3207784,3208188,"-",29452103,,"Bovatus_RS12670","WP_052587845.1",134,"hypothetical protein"
"chromosome","NZ_CP012938.1",3208348,3209517,"-",29455116,,"Bovatus_RS12675","WP_004296157.1",389,"OmpA family protein"
"chromosome","NZ_CP012938.1",3209559,3209825,"-",29455066,,"Bovatus_RS12680","WP_004296158.1",88,"MULTISPECIES: HU family DNA-binding protein"
"chromosome","NZ_CP012938.1",3209857,3212727,"-",29452750,,"Bovatus_RS12685","WP_004296160.1",956,"hypothetical protein"
"chromosome","NZ_CP012938.1",3212757,3215312,"-",29454745,,"Bovatus_RS12690","WP_052587846.1",851,"hypothetical protein"
"chromosome","NZ_CP012938.1",3215326,3217377,"-",29454671,,"Bovatus_RS12695","WP_004296162.1",683,"fimbrial protein"
"chromosome","NZ_CP012938.1",3217395,3218369,"-",29454558,,"Bovatus_RS12700","WP_052587832.1",324,"FimB/Mfa2 family fimbrial subunit"
"chromosome","NZ_CP012938.1",3218667,3220241,"-",29453548,,"Bovatus_RS12705","WP_004296166.1",524,"Mfa1 family fimbria major subunit"
"chromosome","NZ_CP012938.1",3220329,3221645,"-",29456016,,"Bovatus_RS12710","WP_004296167.1",438,"DUF3868 domain-containing protein"
"chromosome","NZ_CP012938.1",3221650,3222219,"-",29452421,,"Bovatus_RS12715","WP_004296168.1",189,"DUF3575 domain-containing protein"
"chromosome","NZ_CP012938.1",3222487,3223401,"+",29455398,,"Bovatus_RS12720","WP_004296170.1",304,"AraC family transcriptional regulator"
"chromosome","NZ_CP012938.1",3223589,3224809,"-",29453964,,"Bovatus_RS12725","WP_052587847.1",406,"site-specific integrase"
"chromosome","NZ_CP012938.1",3225373,3225858,"+",29455234,,"Bovatus_RS12730","WP_004296172.1",161,"hypothetical protein"
"chromosome","NZ_CP012938.1",3226175,3227428,"+",29452414,,"Bovatus_RS12735","WP_004296173.1",417,"MULTISPECIES: DNA cytosine methyltransferase"
"chromosome","NZ_CP012938.1",3227425,3229998,"+",29451782,,"Bovatus_RS12740","WP_004296174.1",857,"MULTISPECIES: ATP-binding protein"
"chromosome","NZ_CP012938.1",3229999,3230691,"+",29454947,,"Bovatus_RS12745","WP_004296175.1",230,"MULTISPECIES: hypothetical protein"
"chromosome","NZ_CP012938.1",3230684,3231406,"+",29455658,,"Bovatus_RS12750","WP_004296176.1",240,"MULTISPECIES: hypothetical protein"
"chromosome","NZ_CP012938.1",3231458,3231970,"-",29453401,,"Bovatus_RS12755","WP_004296177.1",170,"MULTISPECIES: very short patch repair endonuclease"
"chromosome","NZ_CP012938.1",3232431,3233426,"-",29453995,,"Bovatus_RS12760","WP_004296179.1",331,"MULTISPECIES: DUF4065 domain-containing protein"
"chromosome","NZ_CP012938.1",3233432,3233785,"-",29453637,,"Bovatus_RS12765","WP_004296180.1",117,"MULTISPECIES: type II toxin-antitoxin system MqsR family toxin"
"chromosome","NZ_CP012938.1",3234019,3235674,"+",29455420,,"Bovatus_RS12770","WP_004296181.1",551,"MULTISPECIES: hypothetical protein"
"chromosome","NZ_CP012938.1",3235837,3236241,"+",29456035,,"Bovatus_RS12775","WP_004296182.1",134,"hypothetical protein"
"chromosome","NZ_CP012938.1",3236253,3237539,"+",29453038,,"Bovatus_RS12780","WP_004296183.1",428,"MULTISPECIES: leucine-rich repeat protein"
"chromosome","NZ_CP012938.1",3237675,3238382,"-",29456260,,"Bovatus_RS12785","WP_004296184.1",235,"MULTISPECIES: TIGR02757 family protein"
"chromosome","NZ_CP012938.1",3238425,3239717,"-",29452458,,"Bovatus_RS12790","WP_004296185.1",430,"MULTISPECIES: MATE family efflux transporter"
